{
  "schema": 1,
  "harness": "claude",
  "harnessVersion": "2.1.285",
  "porchVersion": "0.1.0",
  "platform": "darwin-arm64 node v22.14.0",
  "ranAt": "2026-09-30T08:44:33.464Z",
  "passed": true,
  "results": [
    {
      "name": "which-session-am-i",
      "title": "which session am I",
      "result": "pass",
      "reason": null,
      "durationMs": 6055
    },
    {
      "name": "deliver-while-idle",
      "title": "deliver while idle",
      "result": "pass",
      "reason": null,
      "durationMs": 6690
    },
    {
      "name": "deliver-while-busy",
      "title": "deliver while busy",
      "result": "pass",
      "reason": null,
      "durationMs": 36949
    },
    {
      "name": "held-at-prompt",
      "title": "held at a prompt or dialog",
      "result": "pass",
      "reason": null,
      "durationMs": 10259
    },
    {
      "name": "killed-session",
      "title": "a killed session",
      "result": "pass",
      "reason": null,
      "durationMs": 6669
    },
    {
      "name": "without-inside-part",
      "title": "a session without the inside part",
      "result": "pass",
      "reason": null,
      "durationMs": 6470
    },
    {
      "name": "watch-delivers-each-change",
      "title": "watch delivers each change",
      "result": "pass",
      "reason": null,
      "durationMs": 39128
    },
    {
      "name": "self-reported-state",
      "title": "self-reported state",
      "result": "pass",
      "reason": null,
      "durationMs": 6103
    },
    {
      "name": "launch-background",
      "title": "a background session started through porch launch",
      "result": "pass",
      "reason": null,
      "durationMs": 6672
    },
    {
      "name": "launch-interactive",
      "title": "an interactive session started through porch launch",
      "result": "pass",
      "reason": null,
      "durationMs": 8471
    },
    {
      "name": "unknown-session",
      "title": "a session that does not exist",
      "result": "pass",
      "reason": null,
      "durationMs": 741
    }
  ]
}
